{
  "schemaVersion": 1,
  "levels": [
    {
      "name": "Upper",
      "elevation": 300,
      "floorThickness": 30,
      "height": 250,
      "visible": true,
      "viewable": true,
      "id": "level-6"
    }
  ],
  "walls": [
    {
      "xStart": 0,
      "yStart": 0,
      "xEnd": 600,
      "yEnd": 0,
      "thickness": 7,
      "height": 250,
      "patternId": "hatchUp",
      "id": "wall-1"
    },
    {
      "xStart": 600,
      "yStart": 0,
      "xEnd": 600,
      "yEnd": 400,
      "thickness": 7,
      "height": 250,
      "patternId": "hatchUp",
      "id": "wall-2"
    },
    {
      "xStart": 600,
      "yStart": 400,
      "xEnd": 0,
      "yEnd": 400,
      "thickness": 7,
      "height": 250,
      "patternId": "hatchUp",
      "id": "wall-3"
    },
    {
      "xStart": 0,
      "yStart": 400,
      "xEnd": 0,
      "yEnd": 0,
      "thickness": 7,
      "height": 250,
      "patternId": "hatchUp",
      "id": "wall-4"
    }
  ],
  "rooms": [
    {
      "id": "room-5",
      "points": [
        [
          0,
          0
        ],
        [
          600,
          0
        ],
        [
          600,
          400
        ],
        [
          0,
          400
        ]
      ],
      "name": null,
      "areaVisible": true,
      "floorVisible": true,
      "floorColor": null,
      "ceilingVisible": false,
      "levelRef": null
    }
  ],
  "furniture": [],
  "dimensionLines": [],
  "labels": [
    {
      "color": null,
      "levelRef": null,
      "text": "Kitchen",
      "x": 300,
      "y": 200,
      "id": "label-7"
    }
  ],
  "selection": [
    "wall-1",
    "wall-2",
    "wall-3",
    "wall-4"
  ],
  "cameras": {
    "top": {
      "id": "camera-top-1",
      "x": 300,
      "y": 1200,
      "z": 1125,
      "yawDeg": -180,
      "pitchDeg": 45,
      "fovDeg": 63,
      "lens": "PINHOLE"
    },
    "observer": {
      "id": "camera-observer-1",
      "x": 50,
      "y": 50,
      "z": 170,
      "yawDeg": -45,
      "pitchDeg": 11.25,
      "fovDeg": 63,
      "lens": "PINHOLE",
      "fixedSize": false
    }
  },
  "compass": {
    "x": -100,
    "y": 50,
    "diameter": 100,
    "northDirectionDeg": 0,
    "latitudeRad": 0.48,
    "longitudeRad": 1.564,
    "visible": true
  },
  "environment": {
    "skyColor": 13427964,
    "groundColor": 11053224,
    "lightColor": 13684944,
    "wallsAlpha": 0
  },
  "activeTool": "wall",
  "capabilities": {
    "canUndo": true,
    "canRedo": false
  }
}